writer,date,location,text
Robert8724,19-11-2024 04:49 AM,"Fremantle, Australia","Having travelled extensively using self contained AirBnB apartments (with kitchens) in south east asia, there is always the same problem- linen, or the lack of. 
The host almost always fails to provide any tea towels and hand towels. The only linen provided is usually 1 bath towel per person. (So just two towels for a double bedroom apartment). It is a huge negative and makes me want to reluctantly switch to hotel style accommodation. 
AirBNB need to fix this problem, and I do see it as a huge problem because it’s consistent and a big let down for people who book 1-2 weeks especially those who travel lightly and shouldn’t have to cart their own bath towels, hand towels or kitchen dish towels around OMG! 
AirBnB should change the rules for hosting so multiple bath towels , tea towels and hand towels are available for people who book say more than 4 nights. I often stay 1-2 weeks and it is a pain in the ass to keep requesting linen or room cleaning after 5-6 days. 
If you want use the kitchen you need ‘tea towels’ .   CLEANING: also cleaning should be mandatory  every 5th day especially as most apartments don’t have any available cleaning supplies (it’s usually always stored away in a locked cupboard). 

SUMMERY: Lift your game AirBnB as guests should not have to hassle and negotiate with hosts for cleaning and linen! "
David8724,01-04-2022 03:25 PM,"Talavera de la Reina, Spain",
Teresa1574,26-10-2021 11:26 PM,"Westlake Village, CA","Can I send a list of the days booked to my cleaning service.  And, if there is an update will they get that too?"
Julieanna0,24-05-2020 04:09 PM,"San Antonio, TX","Although my Airbnb listing has been paused during the COVID crises, I had a Realtor friend who had a client who needed a place to stay while purchasing a home.  Although it was only supposed to be for 2 weeks, it unfortunately turned into 2 months.  The worst part about the whole experience is the fact that my guest vaped in spite of the Realtor telling him my home was a smoke and vape free environment prior to renting it,--and of course, I went over the same rules.  The apartment in my home that he rented now smells like an old and dirty Super 8.   Bottom line,--he chose to vape for 2 months solid, almost never leaving my home.  I've looked up how to clean up after someone who has vaped and it doesn't look very encouraging.  It appears that vaping leaves an oil on everything that is difficult to clean from any permeable surface, (i.e. bedding, curtains, etc.)  I've also read that it gets in the heating/cooling ducts, and I'm going to leave that to the professionals.   However, before I throw away all of the bedding and upholstered furniture, does anyone have any experience, tips or suggestions as to how to clean up after something like this?  I really am a clean freak,--and I want things clean,--I don't just want to mask the smell.  I will be eternally grateful to anyone who has any help to offer!   ~Julieanna    "
Julie3979,05-06-2021 05:38 PM,"Wellingborough, United Kingdom","Hi, we've just listed our place and the bookings have started coming in already. I have a quick question regarding cleaning fees, we've added it to our listings and can see it's been added to each reservation. However, on the breakdown of each reservation the 'amount paid to us' does not include it, so I'm wondering if its added at the time of payout and we then forward it to the cleaner, or whether it goes direct to them from airbnb? Hope this makes sense to someone lol Many thanks Steve"
Theresa-and-Jan0,13-04-2022 03:33 AM,"Budapest, Hungary","Hello everyone! We are looking for a reliable cleaning (+ laundry) service in Budapest. 
It's an 80qm apartment in the V district. 
We would apreciate every recommendation!
Kind regards
Theresa & Jan"
Mica313,03-05-2022 03:17 PM,"Little Rock, AR","I know this conversation has been had before, but the ones that I have seen are older and I am not sure still active.  I am looking for a reliable cleaning service to turn over my airbnbs that I am about to list.  There are 2 and they are both 1BR/1BA.  Looking for recommendations.  Thank you. "
Florence1191,17-12-2024 07:45 AM,"Miami, FL","I am seeking a reputable and reliable cleaning service in Miami, ZIP Code 33133.
Need advice and/or any recommendations on how I can vet a good cleaning service. Thank you."
Melody96,19-03-2019 09:08 PM,N/A,"Hello community! My name is Melody and I'm a business student in my Marketing course. I have created a survey with 10 multiple choice questions to do with cleaning. I would love it if anyone would take this for me as I need it for my assignment! Thank you! https://docs.google.com/forms/d/e/1FAIpQLSdRGMn3VykGDP724K7LTW49h7cB5Mj8VbwQznxCEgQj6lApRA/viewform?...   (If the link doesn't work by clicking, try copying and pasting in an internet browser)."
Crystal427,25-02-2022 08:33 PM,"Las Cruces, NM","How do I go about offering cleaning services ?   Thank you, Crystal V"
Shannon1119,29-08-2024 06:03 PM,"San Antonio, TX","Looking for cleaning services in Concan, TX or services Uvalde County."
King278,09-01-2025 06:12 PM,N/A,"I personally think this would work, and they guarantee that the exceptional"
Inna22,26-12-2020 04:33 AM,"Chicago, IL","Ander amenities if you scroll all the way down to services, it has ""cleaning before check out"". What does that mean? The guest has to clean? I start cleaning before they check out (a host pulled that one on me once)? That I clean during there stay?"
Linda1783,25-09-2019 04:29 PM,N/A,"Hi Everyone,  Im hoping I might get some advice in regard a recent booking.  I'm a new host since July, and so far have had a mix of 1 to 5 night stays max.  My property has just been booked for 70 nights which I was delighted with.  The guest and I were chatting through the app, all seemed fine. But when I raised the question of me cleaning the space (I would like to keep on top of bathroom and food prep area) for no extra charge, I received a request to let them discuss it and they would get back to me. That was 6 days ago.. What should I do? I've put a lot of work into keeping the flat clean and tidy and the bathroom spotless.  Any advice would be greatly appreciated. "
Jennifer2671,05-02-2021 11:27 PM,"Maine, United States","Newish to Airbnb -listing is in Maine It is impossible to find a cleaner in our location, impossible. Finally found a cleaner and offered a flat rate of $175 for a 2 bed 1 bath cottage She started out good, we gave her a thank you card (grateful she was willing to work) and then her work started to slip She started leaving half eaten food from previous guest in cabinets and the fridge, contacts on the bathroom floor and things under beds. We were nice about it, offered to pay her even more for her time and attention to detail and she quit. Got a new cleaner, who is better, we still pay her the same flat rate of $175, she has been with us since September. We wanted to show her our thanks so we got her a $150 gift card for xmas and more recently a $200 gift card to Ulta. Long story short after the gift cards, things have been starting to slack off and we are very confused the psychology behind it. We are going crazy as we feel the rate of $175 for a few hours of work is great, especially considering how small the place is. Is this a thing when you reward workers the stop working for you? Why is this happening? What do you do about it? What does it take to find good and reliable help? HELP!!    "
Tingting20,12-11-2024 02:06 PM,"College Station, TX","On host-side configurations, I only see a way to set fixed cleaning fee for my listing, I wonder if the platform can support flex fees based on day of week for instance?    "
Valentina32,27-11-2023 12:14 PM,"London, United Kingdom","Hi hosts, I am looking for your advice as to what the best way is to charge guests for additional fees. The house I rent in Italy is a big old villa in the countryside so the heating expenses in the winter and A/C in the summer are enormous. Guests tend to leave both heating and A/C (depending on the season) always on at max power so I end up having to pay a large percentage of my earnings just to cover costs.  Do you tend to include these in the listing price (thus increasing your price and paying booking fees and taxes on an amount which is actually a cost) or do you charge for them separately? I have tried to charge separately based on usage but received mixed feedback and guests do not like to have additional fees to pay when they leave (apart from cleaning fees which can be clearly detailed in the listing). Thanks for your help!"
Bradley-and-Melissa0,18-01-2019 08:17 PM,"Fort Lauderdale, FL","Please...Please...Please! Allow for the cleaning fees to be isolated on payouts. As a host for multiple owners, I have taxpayer information for them and myself within my account. They receive their percentage and I receive my percentage but I am paying for cleaning services out of pocket. This requires me to bill my owners for the portion of the cleaning fee that I didn't originally collect. It is a nightmare for accounting and especially for taxes. "
Chamaine0,27-05-2018 05:55 AM,"Shalimar, FL","Hello   I own a small elite cleaning Service and I co host for a few Super Host and Clean for others.  Here is the problem. Lately we have had reviews complaining about the cleaning fee. These are whole houses or condos some located on the beach. We have nothing but 5 stars for our cleanliness and the in the same review that one raves about how clean the home is they also complain about paying a fee.  We are in a tourist area (Destin FL) and my fees are below that of local management companies.    The complaints have mainly come from people on short stays who think they should pay less. Rather they are there 1 night or 10 the house doesn’t get any smaller the work still has to be done. Bedding has to be washed and changed in every room , towels and so forth. The furniture still has to be vacuumed as our beautiful sand gets everywhere. Every surface has to be cleaned , floors mopped.  I’ m just be fuddled how someone can leave a hand written note for the cleaning staff about our attention to detail and how they have never stayed in a rental so clean then complain about the fee which was clearly listed at the time of booking.   Now with the new Supper Host requirements my owners are nervous over the 4 stars for Value Because of fees bringing down their standings. They have asked me to come up with something to include in their listings but I’m unsure if this is what to do. Any Ideas ?"
Camille617,17-09-2021 09:47 AM,"Westmont, IL",I and my family are currently at an airbnb and it's really bothering how unclean our Airbnb is. We are paying cleaning fees for a wipe down..... there's a rug in the living room that's dirty. It look like it hasn't been vacuumed in years. We have a toddler with us so he's on the floor more than any of us. My main suggestion is can Airbnb create their own cleaning team to go to these properties before guest check in and if the owners deny to allow Airbnb to clean on their behalf they should be charged additional fees as it doesn't look like the cleaning fee is being used properly. I went in the bathroom to switch out the toilet paper and the new roll had throw up on it. 
Karin75,09-01-2022 02:31 AM,"Corinella, Australia",Have just started hosting in a new area does anyone know how to find cleaning help? karin
Nirala0,26-09-2019 09:35 PM,"Waterloo, Canada","Hi there,  I offer guests staying over 7 nights a cleaning visit at least 1x week.  For my current guests (3rd time visiting), the cleaner reported that the place was extremely messy- dirty dishes, food lying around, caked on food on cupboard, garbage left inside etc.  She also believes they smoke, disregarding the no-smoking rule.  Nevertheless, she was not very happy about the amount of cleaning she did on this visit.  I messaged the guests to remind them of the no-smoking rule and to keep the place tidy - that dirty dishes, food lying around and garbage can encourage rodents.  The guests wrote back saying she will discuss my concerns after her vacation, and to let the cleaner know they won't be needing her for the duration of their stay (which will be over a week unattended), and that they will leave the place as they found it.  Since the location is in the tropics, things can get really nasty, buggy, and caked on if left alone.  Previous guests behavior did encourage a rat inside which caused some damages to linens/pillows, and took over a week to get rid of.  The guests don't have any cleaning supplies except for a mop/broom.   What would you do?  Let it fly and not send up the cleaner?  "
Jillie1,06-08-2019 04:02 PM,"Harrogate, United Kingdom","Is 19 the maximum number of ""sparkling cleans"" you can get?  I have 100% 5 stars for cleanliness but I notice that the counter seems to be stuck at 19 and I haven't seen any other hosts go above the 19 mark for the ""sparkling clean"" element?  Has anyone else noticed?!"
Louise105,28-10-2023 03:23 AM,"Queensland, Australia","Hello,   Co-host cleaner   I'm searching for a professional co-host to work with me for my Airbnb listings. I have 3 rooms booked months in advance and would like to find someone reliable to co-host.    The listings are stylish individual rooms within a common shared area space. The house in Hamilton Brisbane.    Send me a message with any questions you may have.   Best Regards, Louise"
Jenna298,28-09-2021 03:00 PM,"Clarklake, MI","We currently do not charge a cleaning fee. Most of our guests are good about leaving the home clean, but a few have left significant messes (broken lightbulbs, cigar butts in the yard, filthy bathtub, etc.). We currently do not charge a cleaning fee, but have considered charging one, then offering to reimburse if the home was left clean.   I would love some insight from experienced hosts..."
Lizandra5,11-08-2020 01:32 PM,"Florida, United States","what you guys do with cleaning , when is a long stay, like a month. I am afraid to get there after a month and then is to dirty."
Karen3504,29-11-2022 07:03 PM,"Taunton, United Kingdom","Hello, it’s my first year and first tax return. I do all cleaning and laundry myself, with costs of washing machine, dryer etc in my own home, not the Airbnb, and of course my time. Can I include this as an allowable expense for tax purposes without any receipts? Thankyou for any advice!"
Art-and-Val0,10-10-2019 10:35 PM,"Bellingham, WA","Our Airbnb suite includes a stove/oven which our guests have been free to use.  Prior to each guest we insure that the oven is clean. Unfortunately, the oven is not self cleaning and we have had a few guests who have used the oven to cook greasy food which splatters all over the inside of the oven.  Manually cleaning of the oven takes 1 - 1 1/2 hours.   We do charge a $40 cleaning fee but don't feel that fee is sufficient for cleaning the oven. Thinking of adding to house rules a restriction on what is cooked in oven and if oven found dirty after guest checks out, we will charge an additional cleaning fee.  Our guests appreciate having an oven to use, so don't want to remove it. Any suggestions or thoughts on how to handle this situation. Thanks"
Calvin173,03-11-2023 11:52 PM,N/A,"I've been giving some thought to the importance of cleaning when it comes to guests, and I'm curious to hear your thoughts on this matter. While it's clear that cleanliness plays a significant role in property management, I'm wondering if it's truly the most crucial aspect. What's your take on this? Do you clean your own property? Do you pay somebody? Do you use a cleaning app? What are your ways to deal with your property's cleaning?"
Lis15,18-03-2018 12:43 PM,"Genneteil, France","I have just joined AirBnB as a host. I own 2 gites (holiday homes in France) of which one has been listed here. The generally accepted situation here is that gite clients leave the place as they find it - clean, tidy and sanitised, essentially ready for the next occupants. The host (me) of course, will change bed linen, towels, handtowels and kitchen linen etc. between sets of guests - but unlike a hotel where one rents a room, the provision here is a spacious self-catering 'cottage'  - which is uneconomical to rent out for a low nightly rate if it is provided clean and ready to use but the client abuses the situation and leaves dirty dishes, pans, dirty floors and surfaces and unsanitised bathrooms when they leave. Also, it isn't easy to have to clean our gite from top to bottom in the time between check out and next potential check in later the same day.   Is that what is meant by 'Cleaning before checkout' which is one of the amenities which can be 'checked' ?  I have added a 'cleaning fee' at the moment but if clients 'leave as they find' then this isnt necessary. I'd appreciate any feedback on this. Lis"
Aj142,19-11-2023 08:47 AM,"Paris, France","My listing is only as great as the team of people taking care of it. I would like to build the best team of cleaners, and maintenance personnel. If anyone has recommendations for great qualified people south of Houston, I’d love to add them to my list. "
Ros0,06-09-2020 08:01 AM,"Richmond, United Kingdom","Hi all After two rounds of renting out both rooms on a longer-term lodging site, I have decided to reserve the second room I have in my house solely for short-term/AirBnB lettings but any time I try and read up on the requirements for cleaning it is all US based and adhering to their standards.   UK-based hosts - what measures are you taking in between guests.   I haven't had this room back on AirBnB since the loft extension was completed and the two 'downstairs' rooms were completely refurbished solely for renting out - I opted to use another site to let out to longer-term lodgers but in a post-COVID environment, it seems a lot easier to only have one long-term lodger in the larger room, and to keep the smaller room for much more transient guests.   I have seen great suggestions like hand-sanitiser in the room, masks - all doable now that stocks seem to be plentiful, and I keep the shared areas clean myself.   Anything else I should be doing?    "
Christi11,11-09-2017 01:50 AM,"Nashville, TN","Hi there!   Are there any great cleaning companies in Nashville, TN that are thorough and reasonably priced here in Nashville that clean specifically for Airbnb's?  Most importantly that understand what's needed for a check out/ check in cleaning.  I would love any recommendations!   Thank yoU!"
Kostis5,13-08-2020 05:58 PM,Greece,"Do hosters have to clean the guest's room during their stay?   Also at the ""price of the room"" there is a choise we can give a price for the cleaning, but.... this price is about per cleaning time or for all the cleaning times?"
Chris-and-Marion0,02-12-2022 09:43 PM,"Los Angeles, CA","I've been a host of a small cottage in my backyard in LA for 7 years. I've always charged a moderate cleaning fee,  $35 to $50. I'm thinking of getting rid of it.  I figure I'll raise my nightly rate to make up for it but wondering if other hosts out there have done it and what their experience has been. "
Kathy1171,01-05-2022 12:49 AM,"Cleveland, TX",I have a home that sleeps 10 and when I have 7 or more it takes a full 4 hours to clean it. But if I have 6 or less I can clean it in 3 hours. I have cleaning fee set at $75 .  Is there a way to set it at $100 if I have 7 or more but keep it at $75 for smaller groups? 
Mandy324,30-03-2021 08:24 PM,"Mesogi, Cyprus","How does this work, it seems to be different for my latest bookings.   I used to charge £30 fee, no problem.   However my cleaner has expressed how demanding and time consuming this work can be and so i agreed to increase the cleaning fee to £35 but on my latest bookings its charging guests £45 and suddenly including a 'Linen' fee which we had previously set at £10 and obviously forgotten about. However i have checked all previous bookings and there is no added Linen fee to those?  Is this Air BnB adding this on our behalf?  Is the Linen fee added after a set amount of days?  Although we have had someone stay 63 days and 27 days and they were charged the old cleaning rate of £30.  Anyone help please? thanks in advance. "
Alex55,10-03-2016 09:33 AM,"Cape Town, South Africa",Please can someone advise as to which company is the preferred cleaning & laundry agents for Airbnb Cape Town. South Africa
Dirk250,17-02-2022 03:28 PM,"Laarne, Belgium","When you have for example 3 cleaning services because they jump in for one another when one is not available, but all 3 have a different rate, but you only want to put one fixed cleaning fee on your posting (probably the highest one), then how to solve your problem that the other cheaper cleaning services can now see the higher cleaning fee on your post?"
Thomas2429,16-07-2021 06:35 PM,"Bath, United Kingdom","Hi, I've been an Airbnb host off and on since 2013. I've also stayed in many Airbnbs with no issue. However I've just had the interesting experience of being a guest and being asked to pay an additional cleaning fee as we apparently left the place in a 'terrible condition'.   For context, we paid £1,500, including the Airbnb service fee and an £80 cleaning fee for a 7 night stay in a large 3 bedroom/3 bathroom house. This was a quiet family stay of 6 adults and a baby across 3 generations. The host is new to hosting, and lives several hours from the property and relies on a cleaning company to turn the property around between guests. We had to wash the towels on our arrival as they smelled quite musty, like they'd been sitting in a damp washing machine for some time before being dried.    Apart from being horrified at being accused of this, I just wanted to gauge opinion to see if we might be in the wrong here. I'll try to give the facts as neutrally as possible.    I did the final walk around before leaving the house. I looked for instructions on what to do with bedding and towels, but there were none, so we left the bed turned back and put the dirty towels in the bath. I went through every room, all crockery and glassware was washed and put away (dishwasher was left empty), all rubbish was sorted into recycling bags and stacked in the bins outside the house (collection day was not for a few days, so aside from going to the dump, we had no option but to leave it here).    The host asked us to pay a further £80, as apparently it took the cleaners 8 hours rather than 4 to clean the house. There was no documentary evidence, just what the cleaner had told them. This is the sum of what was passed to us: - house in a mess - kitchen was 'filthy' - grease on worktop - bins left full - some pants were left in a bed - toilets were dirty   As an Airbnb host myself, I feel 100% happy that we left the house tidy. It is absolutely true to say that the house was not cleaned before we left, and the pants in the bed thing was definitely unfortunate.. but my feeling is that cleaning of the property is the responsibility of the host between stays, particularly if a cleaning fee has already been charged. I also feel that 4 hours to clean a property as large as this, along with changing the beds etc. is possibly not long enough anyway.    We refused the charge, the host said he'd cancel the request as it was just our word against the cleaners, and without being on site, he'd have to give us the benefit of the doubt. He said he would expect people to leave the house much as they found it, but admitted that there was no instruction of this anywhere in the house manual. We left a polite but honest review to which we had a very angry response, calling us liars and telling us to never book his property again.    Feeling somewhat wounded by the whole affair! But some honest opinions would be helpful for our future stays, maybe we should have cleaned the place, or maybe this host expects too much of his guests. What do you think?"
