writer,date,location,text
Debra300,01-12-2020 08:16 PM,"Gros Islet, Saint Lucia","I have a long-term guest who is staying with us while he's working in the area.  He initially booked for exactly 28 days, which had him checking out on a Tuesday.  Ten days ago he contacted me, because he wanted to extend his stay by a few days, but he said that the cleaning booking wouldn't allow him to submit the change.  I had chosen 48 hours buffer between each booking, and had to remove the buffer so he could submit his change.  I called Airbnb support, and inquired why was the system not allowing guests of an existing reservation to submit extension requests, because of cleaning buffers.  Of course, the rep is new, and didn't have a reasonable answer.  He responded, ""It's because you manually chose the buffer.""  I informed him that the buffers are systematically applied to the end of each reservation, and should recognize the difference between a new booking request (can't book during a buffer period) and extension of an existing reservation.  ""Well, I don't know."", is all the further explanation that I received.   Unfortunately, this use case can cause the loss of bookings.  Yesterday morning, my guest sent me another message saying that he will need to stay longer in the area, and wanted to extend for another month, but again he was being blocked by the cleaning buffer.  Within 20 minutes, and before I could respond to his message, another guest had a booked the space.  This worked fine for me (new booking is the same duration as the extension), but I felt really remorseful for our guest, because will have to look for another rental.  Other hosts may lose out in these types of situation, because the new reservation may not be as desirable as an extension of an existing reservation.     @Katie @Nick @Quincy @Liv @Lizzie, Would you please help with getting this item in front of the technical team?"
Fiyin0,22-04-2024 08:28 AM,"Hennigsdorf, Germany","Hello, I've encountered recurring cleanliness issues with my apartments, resulting in guest complaints about my current cleaning service. Can anyone recommend an alternative cleaning service for Airbnb in Berlin? Thank you!"
Carmen2636,04-12-2024 03:47 PM,"Tulsa, OK","Am I being petty?  I asked for an additional $30 cleaning fee as my clean crew now has to come back a 2nd time and remove the fans from the effected area.  They paid a pet fee, however I feel this fee is for removal of pet hair from pet blankets and furniture."
Erik-Paul0,07-08-2022 06:43 AM,"Oakland, CA","The cleaning fee scam is getting out of control. I just did a search, and the majority of the listing, the cleaning, and Airbnb fees were near or more than 100% of the accommodation nightly price. It really costs a host $100 to clean a $150 room for a one-night stay. Your cleaning crew makes more per hour than I do. This is getting out of control.  You need an option to sort by ACTUAL price per night. Not the bait and switch low listing price. I can't believe this is legal. I will be cc'ing the California Attorney General's office about this.  "
Lani20,09-03-2019 09:04 PM,"San Diego, CA","My friends and I have stayed at a few Airbnb’s over the past couple of months and I noticed all of them left cleaning instructions that they were expecting us to follow. They wanted us to wash our towels, take out trash, wash our dishes, strip the beds/pillows of sheets, etc. They all charged us a hefty cleaning fee, so I don’t understand why they expect us to do most of the cleaner’s job. I mean I definitely believe in respecting the units and keeping them tidy, but normal mess like laundry, trash, dishes should not be the guests responsibility.  We had to wake up extra early to ensure all those tasks were done on top of packing our things and getting ready to check out by 10 or 11am. And I’m sorry, but when you’re on vacation, having to wake up early and clean is very annoying. For that reason alone I will most likely not be using airbnb again. At hotels, they don’t require you to do anything. So why do we pay 200 dollar cleaning fees when we do a lot of the work?"
Zeneida2,15-07-2023 09:59 PM,N/A,I have a person but sometimes feels that she doesn’t want the job!
Adelaidesupermaids0,13-03-2025 02:15 PM,N/A,"Looking for a spotless home? Our Deep House Cleaning services ensure every corner shines! We remove dirt, dust, and grime, leaving your home fresh and hygienic. Perfect for spring cleaning or regular upkeep. Experience professional cleaning that makes a difference. Book now for a sparkling clean home!    **[signature removed as it contained advertisement link]"
Nadine127,09-09-2017 12:09 AM,"Gold Coast, Australia","If i'm managing someone elses property and have split the payment so I receive a commission % of the rent, does it also split the cleaning fee?  Is there a way I can set it up (besides Co Hosting as it's limited to 3 owners) so that the cleaning fee goes to one of the bank accounts?  Do you know of another way?  "
Clare594,21-05-2024 02:00 PM,"London, United Kingdom","I am a superhost with a lot of bookings which I normally manage myself. Most are in June and July this summer, most are same-day turnovers I am looking for a company who can organise cleaning the flat, and replace the bed linen/towels ready for the next guests to move in (probably linen hire?). I don't want a full management package. I will be out of the country and would need someone 100% reliable I can trust to do an excellent job also I retain my 5 star reviews. Does anyone have any suggestions for a London based agency or person who will to do this? Thanks x"
Jennifer3975,12-10-2023 10:21 PM,"Beverly, MA",I'm new to hosting as I've always had a manager in the past so I'm inquiring how to best find a cleaning company accustomed to turnover cleaning and staging? Any leads or advice would be greatly appreciated! Thanks in advance!
N/A,18-03-2019 01:16 PM,N/A,"I had guests 3 weeks ago who arrived Saturday (rugby international weekend her in Wales). There were 6 in the party, but only 4 came to drop off luggage and check in. The wife took exception to us being in the property whilst they were here!  She was quite unpleasant.  she told me ""I didnt pay all this money to bunk up with strangers, this is not what AirBnB is about at all"". I explained this is exactly what AirBnB is and that is clear on out booking page that we live here.   As she was taking her luggage out of her car I saw that she had lots of party food (M&S pre-order buffet stuff , far more than enough for 6 people!!).  SHe told her husband to put all that back in the car and off they went into town to watch the match.  They got a taxi back around midnight, collected their luggage, and left in the taxi. Unfortunately they left a case in my kitchen so they had to return the next morning to collect that. Now, 3 weeks have passed, and they are asking for the £25 cleaning fee to be returned as they never stayed.   I'd be grateful for anyone's advice, please.   My personal thought are......   1.  I had to clean the house anyway.  2.  It was a rugby international weekend. Vacant rooms are almost impossible to find.  I could have filled those 3 rooms twice over with last minute requests! 3.  They were clearly going to have quite a few people over for a party. She told me they were meeting up with other family!! 4.  I know it doesn't make any difference, but she was SO rude to me, I really resent having to giver her money back after all this time now.   looking forward to hearing your views Polly xx    "
Soman3,22-07-2024 05:47 PM,N/A,"Hi,   I'm a new host on AIRBNB UK and wanted to know how other hosts have found the journey in automating certain processes. Just a few questions:   1. Is there a specific site where cleaning services are listed on to hire cleaners of your Airbnb?
2. Do you manually buy products such as toiletries, bed sheets, pillow cases etc each month to stock up? 3. How much would you look to roughly spend for cleaning a 2 room airbnb? 
4. How much does it cost you to buy above products?

Thank you!"
Ken-and-Nancy1,09-05-2024 09:15 PM,"Knoxville, TN","Hello!  My wife and I began hosting in Knoxville, TN. back in July of last year.  We're looking for a reliable and trustworthy cleaning service to do turnovers for cleaning and laundry for the month of May.    Can anyone recommend someone that they've used and had a positive experience with in the Knoxville area?"
Daniella34,08-05-2025 12:40 AM,"Lansing, MI",The pura is an amazing investment!  
Keiotha0,26-11-2024 02:34 AM,"Bamberg, SC",I don’t want to charge a cleaning fee. How do I turn this off on the site?
Ben5091,28-12-2024 02:26 PM,N/A,"Hello folks, I have purchase a short term rental in Cape Canaveral area and need a good cleaning service with fair fees. I appreciate any inputs or feedback.   thanks,   Ben"
Heather2182,07-09-2025 11:25 PM,"Wann, OK","Does anyone have any favorite cleaning tools for that make cleaning faster and easier?  I have all tile floors and I’ve looked at all in one sweeping and mopping machines, but there are so many. Any recommendations?  Thanks, Heather"
Mayra-Veronica0,02-09-2024 06:15 PM,N/A,How do i register to offer my cleaning business to the hosts?
Carlos3768,18-12-2021 03:38 PM,N/A,"Hi  I am new to hosting ,  My  place is located in Kissimmee , Fl, can anyone recommend a cleaning service in the Florida area.."
Debra405,17-07-2025 04:15 PM,"Ontario, Canada","If your neighbors or a friend cleans for you, that payment will not be considered for any claim you may need to submit.    Note that if you want to submit a claim for extra work caused by an inconsiderate guest that leaves a mess behind, you must meet the requirements stated by the Air bnb Rep, copied below.    ""Finally, we appreciate you sharing proof of payment for your cleaning service. However, to meet verification standards, a professionally issued invoice is required. This should include either a business website or a company name card to help us validate the details."" per Jessy on July 16, 2025"
Raymond541,05-08-2025 04:40 PM,"Troutman, NC",My listing only charges $50 for a short-stay cleaning fee even though I don't have this option set up. It is resulting in lost revenue. How do I get this to stop happening and how can I get that lost revenue back?
John7483,16-11-2023 10:24 AM,"Sileby, United Kingdom","Our place is very old with very old brickwork, there is absolutely no chance that it will ever look 100% clean, will never happen, that said its so very clean everything spotless after making a very difficult choice of firing my niece who now will never speak to me again.   We have a brilliant cleaning company that have made a huge difference to our place new pots new pans new everything, but still no joy in the cleaning feedback, I don't know what to do.   Some pics below of our place."
James3776,04-09-2023 11:04 AM,"Mermaid Waters, Australia","Is anyone aware of this policy that AirBnB has told me about.  Apparently, if a guest arrives at the property and the change-over clean has not been completed (therefore, delaying check-in time by an hour or two) then the host has to provide 30% refund of one night PLUS refund the entire end-of-stay cleaning fee.      Due to this ""policy"", I had my account deducted without my approval for $450!  AirBnB tell me it's ""policy"" but fail to provide me with where I can read this policy.  Since I pay a professional AirBnB change-over Cleaning company (linen and towels incl), I am out of pocket and the guest enjoyed their stayed in a clean property, and left it in a mess!!   This policy exposes all hosts to losses, especially for  1-2 nights stays.   And nothing a host can do about it!   If anyone knows where I can find this policy to refund 30% +  100% end of stay cleaning for a deferred check-in to complete change-over cleaning, please advise.  Most appreciated.   Otherwise, Hosts be aware.  AirBnB may be making up policies as they go in favour of the guest and at the hosts expense.  I am now rethinking if AirBnB is an organisation I want to partner with."
Richard2382,06-11-2024 10:18 PM,"La Asomada, Spain","I charge 95€ per stay , it works for me , so it covers from 3 day stays to 4 week stays, as I encourage longer stays, as it helps the host fill the empty gaps , between lower amount of days stays, but it covers the cleaning of our villas and private pools,  every 7 days, at no extra cleaning cost for the guest. This has never been an issue for us as guests are happy to pay, and encourages longer stays. 
Maybe for 2025 I’ll put the cost up to 125€ around 105$ due to inflation costs. "
Yvette356,14-12-2024 08:02 AM,N/A,"Some people equate strong scent or fragrance to cleanliness. There are many low toxicity products now widely available that have low toxicity and low immunological reactions and have safe, natural fragrance The worst products are made by big corporations who don't care about your health. We with these sensitivities are the canaries in the coal mine. If a place uses low toxicity products, it benefits everyone. "
Steven1413,24-01-2023 10:47 AM,"Worcester, United Kingdom","Hi all,   I'm very new to this.  I am currently refurbishing a property in Worcester, UK.  I am just looking at my options.  How do I go about finding a local company that can help with cleaning and turnouts for me?     All advice welcome.      Regards   Steve"
Jossy0,06-06-2017 03:49 PM,"Glasgow, United Kingdom","if i have a guest staying for a month, do i clean the room and change the bedspread once a week"
Laura7046,26-03-2024 01:19 PM,"Cuyahoga Falls, OH","Struggling with the fees. How much? Should I charge? Renting a whole farmhouse with a salt water therapeutic hot tub, so extra cleaning and chemicals. 3 beds, 2 baths, kitchen etc. does anyone else provide a hot tub such as this? Pool? PS no children allowed, no parties. "
Phillip399,28-12-2023 08:18 PM,"San Clemente, CA",I set my cleaning fees at $305 and guest are charged as part of the booking. What percent is charged in taxes on the cleaning fee? 
Breanna104,18-08-2025 12:24 AM,"La Vergne, TN","My mother was assaulted by the owner of the cleaning company she works for today after being fired. I don’t believe she only does Air bnb’s but a vast majority of her clients are Air Bnb owners. * in Murfreesboro TN assaulted my mother today and when my mother mentioned calling the police she scratched herself and said “I can too now” and that’s what she did.   She’s toxic, she’s abusive and a terrible human all around. Stay far away.   *[Sensitive information removed in line with the Community Center Guidelines]"
Heidy14,31-03-2024 05:29 AM,"California, United States","Hi you all! Hope you are doing great! I host an apartment in South America and live in the US  I need your opinion on this one.  My last guest extended his stay for 15 days, I approved it and told him there will be an extra fee for cleaning which he agreed. Three nights before he left I send him a check out reminder, also gave him a heads up I will request a extended cleaning fee payment, he replied the next day, this was 2 nights  before his reservation was over, telling me that he is leaving one day early  and that I Can use the money for the last night he was not going to stay for the cleaning fee….. I told him, I can’t change the reservation and the fees. He said you can make arrangements with airbnb about that. 
He left and still hasn’t send me any payment. Although he left the apartment in good shape and was polite right for the start, but I didn’t like he didn’t comunícate he was leaving early til I contacted him, after that he never contacted me again…  I appreciate your thoughts…..         "
Michael8005,28-11-2023 03:29 PM,N/A,I had a guest whose husband sent me a message from a different Airbnb email/text  requesting the refund on their cleaning from their last stay. They claim they left the place in immaculate and gave me a good review so I should refund them their cleaning deposit. I told them no because I have to pay people to clean anyway and do the laundry and the floors so I'm sorry I can't.   But I was wondering if anybody else gets this request a lot and how they deal with it
Adela223,16-06-2023 11:18 AM,"Prague, Czechia","Hello,   I am looking for someone who can help me during summer period especially July to do check-in and cleaning of apartment. The apartment is based in Praha 10 - Vršovice.   Please contact me via email: **   Look forward to hearing from you,   Adela **[E-mail address removed due to safety reasons - Community Center Guidelines]"
Lindsay579,27-02-2024 02:23 AM,"Waikoloa Village, HI",Why is the Host keeping $50-75 per clean and not paying me (the cleaner who does all the actual cleaning) the full amount? Is this legal? She already charges the owner 10%. Is there a remedy for this?
Nadine815,15-11-2023 05:50 PM,"Stanford, CA",Where can I buy everything in one place for good price? Amazon quality is inferior and I don't want to keep going between other suppliers and/or doing trips to Costco. What do you guys do?
Megan501,05-10-2020 06:59 PM,"Ashland, KS","After hosting 1 year, I've already had to ""fire"" 2 cleaning companies. They just don't get into the details like they should. Now I'm on the hunt for a different crew. Any suggestions on how to set up expectations from the beginning?   I've done the check list of places to clean and that was never marked off completely. Considering asking cleaners to take photos after they finish with each room.   The last cleaning crew I had literally skipped over 2 bathrooms. I sent the cleaning crew owner pictures and she said I should've ordered a deep clean because guests were here so long. Never acknowledged that hair was in the shower still! How can I avoid this and trust that my house is getting cleaned between guests when I'm not here to monitor?"
Diana2511,08-11-2023 11:47 PM,"Rutherford, TN","Hi I’m new to hosting and would like to know what cleaning methods work for your Airbnb.  Do you clean comforters and mattress pad behind each guest?   What’s the average cost for cleaning a 3 bedroom, 2.5 bathroom 1325 square foot home?"
Guillermo725,03-05-2024 04:24 PM,N/A,"Hi. does anyone know an honest, nice cleaning lady to clean my Airbnb house in yucca valley only in Sundays check outs? thanks!"
Katherine1216,21-12-2024 06:39 PM,"Lansing, NY","I think it would make more sense to call it a one time turnover fee, that way, guests can see the advantage of staying more days to increase their nightly savings. By calling it a cleaning fee, I think guests do think they can leave a mess, failing to understand that the act of turning over the space (deeper cleaning, laundry and set up for the next guest) is difficult for shorter stays without a price bump."
GnG1,15-04-2025 06:00 PM,N/A,"Vacations are supposed to be relaxing, not stressful. But nothing drains your post-trip glow faster than a hefty and unexpected cleaning fee tacked onto your bill. Cleanliness isn’t just about tidiness—it’s about respect for the property and the next guest who’ll stay there. When you stay in a vacation rental, you're stepping into someone else’s space, and with that comes responsibility. Let’s talk about how to avoid cleaning fee mishaps and ensure your getaway remains free from drama.   What Are Cleaning Fees (and Why Are They Charged)? Cleaning fees might feel like a sneaky addition to your final bill, but they’re not random. They cover the cost of professional cleaning services to ensure the property is spotless, sanitized, and ready for the next wave of guests. Property owners rely on these fees to meet professional standards, ranging from laundered linens to sparkling countertops.   That said, cleaning fees aren’t a one-size-fits-all sort of thing. They vary depending on factors like the size of the property, its location, and the level of service provided. A cozy one-bedroom cabin may have a modest fee, while a sprawling beachfront mansion might come with a more eye-watering charge.   The key is to know what you're paying for and manage your expectations. No, guests are not usually expected to deep clean, but yes, there’s an unspoken agreement to leave the property in reasonable condition. The clearer you are on what the fee covers, the less likely you’ll run into surprises.   Be Prepared: Do Your Homework Before Booking The easiest way to avoid cleaning fee confusion? Research the property before clicking “Book Now.” Start where it matters: the listing. Property descriptions usually include line items like cleaning fees and house rules. Read that fine print carefully. If there’s wording like “Additional charges for excessive messes,” note it—it could save you a financial headache later.   Guest reviews are another goldmine of information. Look for mentions of cleanliness, particularly in how property managers enforce cleaning policies. Other guests’ experiences can offer clues about what’s expected.   Still unsure? Don’t hesitate to ask questions. Reaching out to the property manager is not only acceptable—it’s smart. Ask specific questions to clarify what the cleaning fee covers and what’s expected of you at checkout. Clear communication now prevents miscommunication later.   Staying Clean During Your Stay Once you’ve arrived, it’s all about developing simple routines to keep the space tidy. You don’t need to scrub floors or vacuum daily, but small habits go a long way in avoiding cleaning fee debacles. Tidy as You Go: Wash dishes after meals, wipe down surfaces, and put things back in place. Staying ahead of messes means less stress come checkout time.   Be Trash-Savvy: Know where trash and recycling bins are, and use them often. Don’t let garbage pile up or leave it scattered.   Spills Happen—Clean Them Immediately: If you spill coffee on the rug or drop pasta sauce on the counter, address it right away. It minimizes stains or damage, often sparing you an extra charge. If you're traveling with kids or pets, extra vigilance helps. Accidents are inevitable, but how you handle them can make or break post-stay disputes.   Wrapping Up: The Art of a Smooth Checkout Checking out isn’t just about locking up and leaving—it’s about leaving the property in a state that acknowledges the next guest. Most vacation rentals provide a checkout checklist: Stick to it. Common tasks include loading the dishwasher, gathering used towels, and ensuring trash is thrown out. While rarely required, stripping the bed or starting a load of laundry is also a nice touch (and may even earn you kudos from the host).   If the property manager hasn’t provided detailed checkout instructions, focus on the basics. Leave the space reasonably clean—like you would if a friend were visiting, not a cleaning crew.   Before you leave, take a few minutes to walk through the property. Snap photos of each room to document its condition. This protects you in case disputes arise about damage or cleanliness. If something broke during your stay or you noticed a problem, report it to the property manager proactively. Honesty and transparency go a long way toward resolving issues amicably.   Communication: A Key to Staying in the Clear Good communication with your property manager is like a safety net—it can catch issues before they spiral out of control. Ask questions, clarify policies, and let them know if something unexpected goes wrong. A little courtesy goes a long way in keeping the relationship friendly and fee-free.   Remember, property managers are people too. They appreciate guests who show consideration for their efforts to maintain the property. By fostering a polite and open relationship, you’re not just avoiding cleaning fees—you’re also helping lay the groundwork for a positive experience for all parties involved.   Final Thoughts Cleanliness isn't just a property manager’s responsibility—it’s a shared one. By managing messes during your stay, researching policies ahead of time, and following reasonable checkout practices, you can avoid cleaning fee horror stories altogether. Plus, you’ll leave behind a space that’s ready to welcome the next happy guest.   If you’ve had a great experience (or a hard-learned lesson) about vacation rental etiquette, consider sharing it in the comments below. Your insight could be the encouragement someone else needs to embrace this shared sense of responsibility—and make the world of vacation rentals cleaner and kinder for everyone.   By taking the time to understand cleaning fees and practicing thoughtful habits during your stay, you’ll not only avoid unexpected charges—you’ll elevate the entire vacation rental experience. And isn’t that what a getaway is all about?   Happy travels!"
Ambar27,21-11-2023 10:08 PM,"Boston, MA","Hello community,   I am a new Airbnb host and I was wondering if anyone hosts in Costa Rica, specifically Nosara? I’m looking for a cleaning service or a project management company that would be able to provide a cleaning service for a 2 bedroom apartment. Looking forward to any advice anyone can provide! "
Dmitry170,28-02-2024 11:58 AM,"Prague, Czechia","Hello, do anybody knows if the guest can leave the review after a host charge him an additional fee for cleaning, for instance. I mean, the apartment is total mess, and I as a host, charge additional, lets say 20 backs, for cleaning. The guest decline payment and above that leave you a 1-star review. Could that happen?"
Teresa1704,02-03-2022 09:17 AM,"London, United Kingdom",I’m sure there’s a setting somewhere that allows you to leave a day or two in between bookings but can’t seem to find it. Can anyone help with this please ? many thanks 
