writer,date,location,text
Martin280,21-11-2018 01:50 AM,"New York, NY","Okay, I've looked at other posts and this has been mentioned time and again.    Let us set custom cleaning fees based on trip length and number of guests!  Let us remove cleaning fees for set dates on our calendar!   I can't manage my calendar effectively when I have 4 days open in a row on my calendar for example. If someone books the entire four days I want them to pay the full cleaning fee. It's reasonable then. But if someone is staying only 1 day I want them to pay a lot less. But I can't do this with the current system. So it hurts me for people who want to book single days because the rate seems exorbitant, because it's reasonable for someone whose booking it for all four days.    This is ridiculous airbnb. Let us change this so that we don't have this yo-yo pricing on our calendar because we're trying to hedge which type of reservation we might get and base our pricing on that including the cleaning.    I'm like other hosts, there is NO way I'm not charging for cleaning. It takes 9 hours to clean the entire apartment and some people are slobs. "
Darin57,25-07-2022 08:10 PM,"Dripping Springs, TX","The system did not charge a cleaning fee on our last booking.  The customer service agent seems clueless about how the system works, as she has suggested multiple options that would not address the issue: 1. Contact the guest directly and ask them to pay a cleaning fee.  This is an absurd suggestion for obvious reasons. The guest would think it's a scam and no doubt give us a bad review. 2. Check the box on our listing to reduce the cleaning fee for shorter stays.  Again - doesn't address the issue. 3. Use the Resolution Center to contact the guest and explain the situation.  You CAN'T use the Resolution Center for a guest who hasn't check in yet.  Why are the customer service folks so lame?    It's very disheartening to have such a simple issue that airbnb will not take ownership of and fix.  Now it looks like we have to cancel the reservation and hope that it works properly when the guest re-books. And we would pay a $50 fine for canceling the booking. "
Leland16,13-03-2022 06:10 PM,"Gainesville, FL","Hi,   My enhanced clean tag has disappeared from my listing. Anyone else with this problem? I am looking through other listings and I don't see it on others' listings. Are they doing away with it? Customer service doesn't know and is forwarding to technical team."
Jim1836,05-04-2022 06:36 PM,"Sunbury, OH",If I change my cleaning fee to a higher price does that effect current bookings already scheduled  as well?
Pamela923,07-03-2021 06:00 PM,N/A,"Hi I am a professional cleaner and I'm seeking to offer my cleaning services. I can provide hotel-like, quality housekeeping (CONSISTENTLY) and also offer turnover services that not only make a host's life easier, but also create 5-star hospitality experiences for guests. Feel free to reach out to me in case you have any questions.
Pamela White"
Suzanne302,19-04-2019 02:01 PM,"Wilmington, NC","I just saw a homeshare listing with a cleaning fee of $50! The cleaning fee was higher than the nightly rate. Which got me thinking...Are there guests out there who would actually book this place?   I don't see how the host could justify a $50 cleaning fee. Mine is a modest $10, which I think is fair. I was thinking of raising it to $15.   What do other homeshare hosts charge? And does your nightly rate influence what you decided to charge? How do you justify your cleaning fee?"
Clare61,12-07-2020 10:45 PM,"Orange Beach, AL","We arrived to clean our condo today after our guest checked out only to find a pile of vomit everywhere in the master closet, up the walls and baseboard, over the ironing board and in all the crevices of the closet sliding door. It was totally disgusting and took a while to clean up. Would you charge an extra cleaning fee and if so how much?
Thanks. "
Dave-and-Deb0,03-06-2017 03:10 AM,"Edmonton, Canada","There are mixed feelings of many hosts whether to have a cleaning fee on their listing or not.  Some hosts add a cleaning fee in their listing while others build it into the price.  Here is a Help Guide on how to add a cleaning fee to your listing.   ***NOTE: This Help Guide has been created using the new layout so if you have a different layout, please visit https://community.withairbnb.com/t5/Hosts/Adding-a-Cleaning-Fee-A-Community-Help-Guide/m-p/53351#M24...   First of all, if you do not have the option to add a cleaning fee, you will need to publish your listing first and then the option will be available.  I recommend to publish your listing and then quickly unlist it so that you get the full editing options for your listing.   Step 1: Click on ""Host"" and then ""Manage Listings"" and then choose the listing you wish to add the cleaning fee to.      Step 2: From the choices, choose ""Pricing"" and then go to the ""Extra Charges"" section and choose Edit.      Step 3: Go to the ""Cleaning Fee"" section and then enter the cleaning fee followed by selecting ""Save""   "
Louis26,24-06-2016 07:00 PM,N/A,Hi I was wondering if it s part of the policy that a guest cleans the house so it is the same condition as when he arrived. Thanks!  
Shelly94,09-09-2019 09:51 AM,"Sherfield English, United Kingdom","Hi all, Is it possible to add a one off cleaning fee to each booking, which could then be returned once the guests check out - if they have left the place in a satisfactory state?   I have found recently that after a year of being a host, I am suddenly encountering lots of ""dirty"" guests and have suffered more breakages in the past month than in the previous year!   I think a returnable cleaning fee would be a great way to motivate guests to be more respectful of our property. What do you guys think?   Thanks"
Amber595,18-11-2021 01:55 AM,"Orange City, FL","Hi new to out of state rental, we live next door to current airbnb so it's easy to manage. I do all the laundry of sheets and towels. Does your cleaner wash your sheets and towels or how does that work?"
Sharon1074,29-03-2022 02:51 AM,"Wichita Falls, TX","Hello everyone! Although my listing is for one guest and no pets, my weekend guest brought her significant other and a dirty, large dog. Although I am in contact with Superhost Support (my rep is doing great), my concern is cleanup. I have removed all (or thrown away) any soft surfaces, aired out the suite for hours, cleaned every surface (and the air filters), and used enzyme cleaners, I still smell the dog. I used my UV light and did not see any messes, so this dog was just dirty and smelly. My questions are this: any tips of cleaning out a dirty dog smell? What measures do you use to make sure linens and surfaces are bug (mites) free? I'd rather not have my next guest have issues. As a side note, I've had service dogs before (guests have both let me know during reservation or when they come) and welcome them. This seemed to not be the case.   Thank you!"
Blue-Juniper-Homes0,17-03-2020 06:27 PM,"Atlanta, GA","If you are a host, what are some ways that you manage your cleaning service and laundry service expenses with the amount of income received from your cleaning fee?  Does your cleaning fee adequately cover these costs or have you had to raise it over time? "
Richard468,24-09-2017 10:45 PM,N/A,"I am interested in starting my own cleaning business. I was wondering if after people are done renting, I could come in and clean the space before the next rental.  "
Susan990,29-11-2021 08:41 PM,"Redmond, OR","The conversations about cleaning fees and ABB fees and Pricing displays deserves a good look at the way ABB explains these charges to the Guest consumer.  Place cursor on Cleaning fee and read "" This is the fee the Host charges to clean their property"" Now read the cursor message for Service fee and read "" this helps support this platform which provides 24/7 customer service"" or something similar. Notice the subtle distortion? My solution is to think like a Hotel and calculate the actual cleaning costs to run your Listing annually and divide by 365 days and you have your daily rate to stuff  in the nightly  price.   Then I add to the value of my places by stating in the marketing remarks-- No cleaning fees, security deposits, or additional charges. Flat rate pricing. Plus, for my area the high demand  for monthly stays rules the top of my market so I have set 31 day minimum reservation--what this does to the hotel/tourist/lodging taxes is it VOIDS them... not legally collectable on monthly reservations.  End result-- the only Fees added onto the price are the ABB fees. P.S.  I skip out on all the weekly, monthly discount section totally none of it for me.  This formula has worked very well.  Clean simple math. No confusion. Occupancy rate at 93% today."
Laura5388,03-04-2022 05:05 PM,"England, United Kingdom",I see others had the same issue in the past. Has anyone not been able to delete the cleaning fee? I have tried different devices and internet servers/pages or whatever they are called and no luck. I have also tried putting '£0' but it has to be at least £4 and no option to delete.  Thanks for any help. 
J-Brooke0,14-06-2019 08:18 PM,"Portland, OR","I'm a Superhost and have had 2 AirBnB units for the last 3 years.  I had a great cleaner for 2.5 years but he got a new job. As such, I'm looking for a new cleaner who's available btwn 11am-3pm. Both units are in NE Portland, in the Cully neighborhood. I currently have 3-8 cleanings per week, depending on the season. Cleaning includes doing laundry. Can anyone recommend a cleaner or a cleaning service?   Thank you! Brooke"
Shay2,13-06-2016 06:05 AM,"Los Angeles, CA",Hey Fellow Airbnb friends. I have a guest who had been in my whole apartment for 6 days and not they are compalining that its not clean and want a discount. What should I do?
Ariana1210,18-10-2024 04:36 PM,"Jacksonville, FL",I need a cleaning lady in jacksonville florida
Lesley218,09-03-2019 08:19 AM,"Caston, United Kingdom",I am new to airbnb hosting and just had a booking where the amount of cleaning that I had to do was more than normal i.e. cooker .  I do not currently put a cleaning fee or a deposit request on my reservations and my preference would be not to do this because I think it may put people off booking.  Where or how do hosts state within their listing the expectations on the condition of how the property should be left by a guest.   
Chris14135,05-05-2021 03:17 PM,"Leland, NC","I can't seem to find a cleaning company in Leland, NC close to Wilmington. \ * Community Center Guidelines] - Please note that it is not allowed to share any personal details such as emails and phone numbers publicly. "
Eloise26,01-09-2019 04:35 PM,"England, United Kingdom","Hello,   I'd like hosts' honest opinions on recent feedback I received from a host.   Context: We'd booked an entire house for a week as part of our honeymoon. We never saw the host in person as he lives 200 miles away.   His public review stated: ""the house was left dirty, and a window left open which could have resulted in water damage.""   It was a big house with lots of windows which we did check before leaving, I can only guess we hadn't latched one quite right and it managed to blow open. It was an honest mistake but I understand his frustration.   However, I don't understand the 'dirty' comment. Privately, he said:   ""It was disappointing to find the house had hardly been cleaned when we arrived yesterday. There were lots of bits of food etc under and around the dining room table - the floor clearly hadn't been hoovered. The kitchen hob hadn't been cleaned, neither had the worktops. An oven tray had been used and shoved back in the cupboard without being cleaned. Bathrooms weren't too bad but the downstairs one at least hadn't been cleaned properly.""   It seems the expectation was for us to leave the property exactly as we found it, which is an expectation he has since added to his listing. We followed the check out instructions (strip beds/take rubbish to kerbside bin /empty dishwasher/leave everything (in our own minds) clean and tidy) and there was no instruction to vacuum. We had wiped down the hob and worktops, there was no significant mess/spills/stains etc but we hadn't performed a deep clean. The baking tray was an oversight - I think my wife must've assumed I'd already cleaned it and put it away. I'd thoroughly cleaned the upstairs bathroom, but seeing as we'd only used the downstairs toilet a couple of times I hadn't given that much attention.   We've received positive feedback from other hosts and I wouldn't think much of it, just that the host has very high standards, if it wasn't for the fact that the host has left reviews of other guests complimenting how they left the house. During our stay we saw an older version of his house manual before it was updated, which asked guests to thoroughly clean and tidy everything to the same standard you would expect when arriving, as sometimes he does not visit in between guests, and telling guests where to find bed sheets to make the bed if they arrive when he hasn't been to the house in between. We thought this was quite strange and assumed it was unsustainable which is why it had been changed with less strict cleaning expectations, but based on his feedback it did seem as though those expectations are still there.   So, I'd genuinely like to know hosts' thoughts and their expectations for how clean guests leave their own properties, especially with regards to vacuuming/bathroom cleaning.   Thank you!"
Cristina-And-Daniel0,22-06-2016 04:55 PM,N/A,
Robert4911,05-08-2020 12:34 PM,"Turlock, CA","Hello Everyone, Our place is in the Sierras and we have had a hard time finding a cleaning person that will do the job up to our standards. Ant tips on where to find a good source? I notice a lot of other owners in the area post in a FB group asking for a cleaner. Right now we are doing it ourselves.  Thanks  Robert "
Robert5255,23-03-2021 03:13 PM,"Guadalupe, AZ","Hi folks, Just looking for advice on cleaning services/people for Flagstaff, Arizona.  Any advice?  Greatly appreciated! R"
Jan-and-Sophie0,22-07-2019 11:21 AM,"Vienna, Austria","Hi everybody,
I am looking for help with cleaning my apartment in Budapest.
Can somebody offer me a good deal?
I have my own airbnb experience, don't need somebody to manage the bookings, just to clean and maybe to take care of check in/out (this depends on what we agree).
Thank you very much.
Zsofi"
Joshua495,03-02-2020 02:39 PM,"Durham, NC","Im new to this and I was curious about the requesting money.  Since it goes through the resolution center, I do not want Airbnb to leave a negative mark on the recipient of that request.   Does the recipient get any negative mark when you request money.  I want to use this as an easy alternative to charging a pet cleaning fee.  Is Airbnb ever going to make this simple and part of the reservation?   Joshua"
Erin5378,05-08-2021 01:44 AM,"New York, NY",
Victoria576,30-01-2020 10:06 PM,"Western Australia, Australia","This is a slightly unusual one. I have an AIRBNB guest house and live next door so I do all the cleaning. I currently do not charge a cleaning fee as my area is high volume tourist based and the market is quite flooded. AirBnB continue to try and lower prices too. I am going overseas, potentially for a month at a time and am quite booked up so will need to not only honour current bookings but also have someone do the changeovers. Since I live next door I was wondering if anyone has ever offered a heavily reduced, longer term booking in exchange for cleaning / changeovers? I hope this question makes sense."
Janessa2,24-02-2019 07:33 PM,"De Kalb, MO","HI, My Name is Janessa Pierce. I am looking for a cleaning lady in the Lake of the Ozark area. I have a 3 bedroom 2 bath house. Please let me know if you are interrested or know someone that is.    Janessa Pierce"
Eran17,25-03-2019 04:11 PM,N/A,"Hi fellow hosts! I'm new to the community and just started hosting my first unit (with help from a management company). I'm looking for a cleaner who can handle the quick turnarounds 7 days a week. We're currently using two different cleaners with limited availability and can mostly cover things but I'd really like to have one consistent service who can come any day, and obviously hoping that pricing is reasonable (I've seen a wide range out there). Would love to hear any recommendations or tips. Thanks so much!  "
Brooke-And-Eric0,05-10-2019 07:11 PM,"Clearwater, Canada","Hello, this is my first year hosting and i am trying to figure out my best option for cleaning fees. We live in an area where it is driven by tourism and slows down tremendously in the winter. During the summer we rent out for $350  plus $100 cleaning fee but in the slow season we can only rent out for 80-100 so I cant charge a $100 cleaning fee. In the winter when it is slower I will be cleaning the home myself but in the summer we have to hire someone as I have two small children at home. I recently had to remove my cleaning fee and adjust my nightly rate from $350 to $450 a night for next summer. Is there any way to set the cleaning fee to certain amounts for certain dates? or does anyone have any suggestions for what I could do?"
Breonna1,28-01-2020 01:24 AM,N/A,Hi just wondering how we add cleaning fee incase incidentals ...
Phillip111,10-06-2020 12:31 PM,"Throne, Canada","Hi Hope you Airbnb hosts are all safe and well. I am a super host in the Uk with 3 self contained units all with their own private entrance, these units I clean myself. I have been reading the new Cleaning protocol and handbook but can see no mention of using sanitation fogging machine. Has anyone out there used them and are they up to the job, I have considered buying one to use before entering room there after clean. The cleaning product recommended kills Covid-19 after 5 minutes and sanitises the room once used. Any thoughts or advice would be great. kind regards Phil "
Venessa15,22-09-2022 03:42 AM,N/A,"Hi there. My name is Venessa. I'm offering a cleaning services, to all hosts in Cape Town, Rsa. My prices are reasonable, which includes laundry.  I look forward to hearing from you. Thank you kindly for your time and attention. "
Ellen99,20-02-2020 03:27 PM,"Sawyer, MI","Hi.  During these winter months I would like to NOT charge a cleaning fee to entice more guests, and it has worked to some degree.  However,  the fee will change to 100.00 as soon as tourist season begins. Since people can currently book my place 3 months ahead, I got one May reservation in which there was no cleaning fee applied. My bad. Do the settings allow the cleaning fee to change/be applied once a certain time frame comes? Like May?  Or do I really have to manually lower my base price for every day in the winter,  to remain affordable?"
Lynn1369,25-08-2021 08:32 PM,"The Woodlands, TX",I'm a new host and was hoping community could offer advice for proposed extended stay cleaning fees 28+ days  
Gisele135,11-08-2021 11:17 PM,N/A,"Hello hosts! My name is Gisele and I am a house cleaner in the Richmond-VA area. I have experience doing regular home cleanings, move outs, small offices and vacation rentals. I would love to connect with you, if you are in need of a cleaner for your Air BnB.   It will be a pleasure to help you!"
Krista6,06-06-2016 11:15 PM,"Charleston, SC","I've agreed to waive the cleaning fee for a guest. Is there a way to ""turn it off"" for their booking or can I refund it after they book?  Any suggestions on how to handle this would be much appreciated. "
Cindy1197,29-04-2022 11:21 PM,"Guysville, OH",We're just building a few Airbnb cabins are are picking out appliances. Would you recommend self-cleaning or manual clean ovens?  Thanks so much for any feedback! 
Marianne294,17-11-2020 12:17 AM,"Winchester, TN","I urge Airbnb to keep the cleaning protocol solely voluntary. It’s great for those hosts to stand out with a cleaning protocol badge, and for guests who are especially concerned about that to be able to find those properties.   If a host voluntarily says they follow the protocol, they are more likely to diligently follow it. Moreover, if guests find evidence that they didn’t, the guests’ reviews hold that host/property accountable. On the other hand, if Airbnb threatens all hosts into following the protocol, I’m sure some hosts will not be as diligent, and guests are sure to discover that. If all are said to follow the standard and even one proves not to, the standard becomes meaningless and goes from goodwill to bad. I would think it could even open Airbnb and hosts up to lawsuits.   Although I appreciate the protocol as a cleaning help, I personally prefer not to mark my property as under the cleaning protocol. There’s still too much unknown about COVID, and it’s impossible to clean every inch of a house and the things in it. (Think about a deck of cards even!) I don’t want to mislead anyone into thinking my house is totally sanitized against COVID. If I were high risk and felt that COVID posed a threat to my life, I’d stay home or do my own sanitizing wherever I went. I don’t want to give my guests that false COVID-free assurance that no one can give.   I love Airbnb. It’s simplicity and the way the ratings work to hold everyone accountable for themselves is brilliant. I appreciate the low overhead that Airbnb charges which I think comes with that simplicity. I urge Airbnb to keep this cleaning protocol voluntary, allowing individuals (both hosts and guests) to determine their own priorities. Let hosts decide what they want to offer, and let guests decide what they’re looking for."
Jos33,21-07-2019 10:17 AM,"Alicante, Spain",AIRBNB DOESN' SAY ANYTHING ABOUT CLEANING ? (BOOKING.COM INCLUDES THIS IN HIS BILL) HOW COME?
Matteo291,19-09-2018 03:18 PM,"New York, NY","Hi,   I am not sure this is the right place to post, but I want to start renting a property around Huson, NY and I am looking for a housekeeper. I am not sure where to start, and how much is the rate. I found hourly from $15 to $30 (!!) any suggestions?   Thank you,   Matteo"
Kristian13,15-05-2020 06:31 PM,"NY, NY","We have a cleaning person who does an excellent job.  She charges $100 for a single bedroom.  Given the pandemic she is need of more work in Brooklyn so I wanted to see any hosts on here are in need of a reliable person.  If so, msg me and I'll give you the person's number."
Ursula144,18-01-2020 06:19 PM,"Belfast, United Kingdom","Hi I have my cleaning fee set, I want to change this so I can put cleaning fee and service charge. Any ideas?"
Tom153,20-11-2020 04:00 PM,"Asheville, NC","Hello community,   I want to give my cleaning person who has been working for me for over a year a Christmas bonus or tip. She does about 4 cleanings a week for me at $60 a piece. What would be an appropriate year end bonus/tip?"
Alice989,11-05-2020 06:01 PM,"Chicago, IL","Hi everyone,   I'm an Airbnb host and am looking for a good, reliable cleaning service in the East Point area (between the airport and downtown). Does anyone have a cleaner they would recommend? I'd really appreciate it.    Thanks, 
Alice"
Carla1007,17-12-2019 07:56 AM,"Solihull, GB","I am renting an entire place long-term and agreed on a cleaning fee to have the space cleaned but the host told me the cleaning fee doesn't include laundry so I'll have to take all the bed linens and towels myself to some place to get it washed. I'm stunned by this!   The place doesn't have a washing machine, but the host lives upstairs and they do have a washing machine which they didn't tell me to use, they told me to take the laundry somewhere outside to get it washed.    I understand about taking my own clothes, but doesn't make any sense to take the bed linens and towels!   Can you advise please?   Thank you."
Brian1843,09-10-2020 09:22 PM,"Tewkesbury, United Kingdom","Does anyone know of a good cleaning company for Air BnB , covering the Gloucestershire area , specifically Tewkesbury ??"
Patricia744,03-12-2017 03:30 PM,"Staunton, VA","I want to charge my guests a small cleaning fee, since I pay for a cleaner, but I want to let them know this up front. Searching other ads, I don't see any place that fees are listed, although on my host page it's clearly marked. Where do guests go to find fees?"
Janet1570,24-08-2024 05:34 PM,N/A,I have a townhouse in need of departure cleaning. Please contact me. thank you 
Katie1319,18-08-2022 08:12 PM,"Holmes Beach, FL",We have about 200 Vacation Rentals and we use about 40 different cleaning companies. This can cause a lot of confusion and inconsistency so we have been playing with the idea of having an internal cleaning company.  Does anyone currently have an internal cleaning company within their vacation rental company?  Any advice welcome!
Kalila0,22-06-2017 11:55 PM,"São Paulo, Brazil","Hi,    I am a co-host and am helping my parents host an extra bedroom in their house. URL: https://www.airbnb.com/rooms/19329138   We did not offer cleaning services yet, but were wondering how things should work. Is the host responsible for washing the towels/beddings? If yes, how often?    What do you recommend and/or do with your own guests?      Thank you in advance!      "
Virginia637,24-02-2022 06:34 PM,"Raleigh, NC",I have a month long guest coming up and would like to offer weekly cleaning. I have a question about the cleaning fee.  If my guest and I agree on a plan that works for both of us- how do I add the extra cleaning fee?  Is there a feature in Airbnb to add a charge?  Thank you! 
